{
  "schemaVersion": "1.0",
  "id": "useful-work-safe-v1",
  "publication": "safe-synthetic",
  "provenance": {
    "origin": "authored-synthetic",
    "privateDerived": false,
    "note": "Invented teaching content. No SOP thresholds, quotations or package records are reproduced."
  },
  "task": {
    "id": "UW-TASK@1",
    "work": "Prepare Source of Wealth / Source of Funds material",
    "businessScope": "CLM · illustrative PWM&FO periodic review",
    "partyType": "natural-person",
    "jurisdiction": "SE",
    "stage": "periodic-review",
    "purpose": "Prepare a source-linked workpaper and questions for human review; do not assess or approve a customer.",
    "inputs": [
      "UW-SOURCE@1"
    ],
    "requiredKnowledge": [
      "UW-INSTRUCTION@1",
      "UW-CONTEXT@1",
      "UW-SCOPE-SE@1",
      "UW-SCOPE-NO@1",
      "UW-CORROBORATION@1"
    ],
    "method": "UW-METHOD@1",
    "outputContract": [
      "Source-linked statements",
      "Explicit missing information",
      "Questions for human review",
      "No customer risk conclusion"
    ],
    "stopConditions": [
      "Knowledge lacks required authority",
      "Applicability is unresolved",
      "Provenance, amount or ownership cannot be established"
    ],
    "humanDecisionRights": [
      "Accept or reject task output",
      "Determine the next case action",
      "Separately review any proposed reuse"
    ],
    "writeAuthority": "none",
    "evidenceRequirement": [
      "UW-EVIDENCE@1"
    ]
  },
  "facts": {
    "partyType": "natural-person",
    "jurisdiction": "SE",
    "stage": "periodic-review",
    "supportSupplied": null
  },
  "envelope": {
    "desired": "A supported preparation assistant with controlled source access and review records",
    "status": "unknown",
    "runtime": null,
    "modelVersion": null,
    "knowledgePackageVersion": null,
    "identity": null,
    "logging": null,
    "disable": null,
    "write": false,
    "verificationEvidence": null,
    "capabilities": [
      {
        "id": "live-read",
        "label": "Read current FenX case",
        "available": false,
        "verified": null,
        "evidence": null
      },
      {
        "id": "model-call",
        "label": "Call an approved model",
        "available": false,
        "verified": null,
        "evidence": null
      },
      {
        "id": "write",
        "label": "Write customer data",
        "available": false,
        "verified": false,
        "evidence": null
      }
    ]
  },
  "bindingContext": [],
  "supportAssertions": [],
  "objects": [
    {
      "id": "UW-SOURCE@1",
      "title": "Customer statement · invented transcript",
      "family": "source",
      "kind": "source",
      "subject": "Synthetic periodic-review preparation",
      "assertion": "“My wealth comes from my employment and the sale of a small business. The money for this transfer is in my savings account.”",
      "scope": {
        "partyType": [
          "natural-person"
        ],
        "jurisdiction": [
          "SE",
          "NO"
        ],
        "stage": [
          "periodic-review"
        ]
      },
      "authority_for": [
        "What this invented speaker said"
      ],
      "not_authority_for": [
        "Verification of wealth or funds",
        "Ownership of funds",
        "Actual customer information",
        "A policy instruction"
      ],
      "supportingEvidence": [],
      "version": "1",
      "valid_from": null,
      "valid_until": null,
      "status": "synthetic",
      "revalidate_when": [
        "Source, task scope or intended use changes"
      ],
      "relationships": [],
      "lines": [
        [
          "01",
          "My wealth comes from my employment and the sale of a small business."
        ],
        [
          "02",
          "The money for this transfer is in my savings account."
        ]
      ]
    },
    {
      "id": "UW-INSTRUCTION@1",
      "title": "Keep statement and verification separate",
      "family": "meaning",
      "kind": "instruction",
      "subject": "Synthetic periodic-review preparation",
      "assertion": "In this demonstration, preserve the statement with its source line. Do not turn a customer statement into a verified fact.",
      "scope": {
        "partyType": [
          "natural-person"
        ],
        "jurisdiction": [
          "SE",
          "NO"
        ],
        "stage": [
          "periodic-review"
        ]
      },
      "authority_for": [
        "Illustrative preparation method"
      ],
      "not_authority_for": [
        "Institutional policy",
        "Customer risk assessment",
        "Permission to write to FenX"
      ],
      "supportingEvidence": [],
      "version": "1",
      "valid_from": null,
      "valid_until": null,
      "status": "draft",
      "revalidate_when": [
        "Source, task scope or intended use changes"
      ],
      "relationships": [
        {
          "label": "informs candidate",
          "target": "UW-REQ@1"
        }
      ],
      "runtimeEligible": false,
      "modality": "obligation",
      "sourceModality": "obligation"
    },
    {
      "id": "UW-CONTEXT@1",
      "title": "Wealth origin is not transfer provenance",
      "family": "meaning",
      "kind": "definition",
      "subject": "Synthetic periodic-review preparation",
      "assertion": "Source of wealth describes how wealth arose. Source of funds concerns the money used for the particular transaction. A savings-account location alone does not establish its provenance.",
      "scope": {
        "partyType": [
          "natural-person"
        ],
        "jurisdiction": [
          "SE",
          "NO"
        ],
        "stage": [
          "periodic-review"
        ]
      },
      "authority_for": [
        "Synthetic field distinction for this example"
      ],
      "not_authority_for": [
        "Institutional policy",
        "Customer risk assessment",
        "Permission to write to FenX"
      ],
      "supportingEvidence": [],
      "version": "1",
      "valid_from": null,
      "valid_until": null,
      "status": "draft",
      "revalidate_when": [
        "Source, task scope or intended use changes"
      ],
      "relationships": [
        {
          "label": "informs preparation",
          "target": "UW-OUTPUT@1"
        }
      ],
      "runtimeEligible": false,
      "fields": [
        [
          "Prepared wealth narrative",
          "Employment and business sale, as stated"
        ],
        [
          "Prepared funds narrative",
          "Savings account stated; underlying origin unresolved"
        ],
        [
          "FenX mapping",
          "Implementation not established."
        ]
      ]
    },
    {
      "id": "UW-SCOPE-SE@1",
      "title": "Sweden scope note · invented training record",
      "family": "meaning",
      "kind": "guidance",
      "subject": "Synthetic periodic-review preparation",
      "assertion": "This invented note is scoped to Sweden solely to demonstrate applicability. It establishes no Swedish KYC rule.",
      "scope": {
        "partyType": [
          "natural-person"
        ],
        "jurisdiction": [
          "SE"
        ],
        "stage": [
          "periodic-review"
        ]
      },
      "authority_for": [
        "A synthetic scope predicate"
      ],
      "not_authority_for": [
        "Institutional policy",
        "Customer risk assessment",
        "Permission to write to FenX"
      ],
      "supportingEvidence": [],
      "version": "1",
      "valid_from": null,
      "valid_until": null,
      "status": "draft",
      "revalidate_when": [
        "Source, task scope or intended use changes"
      ],
      "relationships": [],
      "runtimeEligible": false
    },
    {
      "id": "UW-SCOPE-NO@1",
      "title": "Norway scope note · invented training record",
      "family": "meaning",
      "kind": "guidance",
      "subject": "Synthetic periodic-review preparation",
      "assertion": "This invented note is scoped to Norway solely to demonstrate applicability. It establishes no Norwegian KYC rule.",
      "scope": {
        "partyType": [
          "natural-person"
        ],
        "jurisdiction": [
          "NO"
        ],
        "stage": [
          "periodic-review"
        ]
      },
      "authority_for": [
        "A synthetic scope predicate"
      ],
      "not_authority_for": [
        "Institutional policy",
        "Customer risk assessment",
        "Permission to write to FenX"
      ],
      "supportingEvidence": [],
      "version": "1",
      "valid_from": null,
      "valid_until": null,
      "status": "draft",
      "revalidate_when": [
        "Source, task scope or intended use changes"
      ],
      "relationships": [],
      "runtimeEligible": false
    },
    {
      "id": "UW-CORROBORATION@1",
      "title": "Separate a statement from its supporting material",
      "family": "meaning",
      "kind": "requirement",
      "subject": "Synthetic periodic-review preparation",
      "assertion": "This demonstration asks whether supporting material was supplied. If that fact is missing, do not infer that it exists or does not exist.",
      "scope": {
        "partyType": [
          "natural-person"
        ],
        "jurisdiction": [
          "SE",
          "NO"
        ],
        "stage": [
          "periodic-review"
        ],
        "supportSupplied": [
          true
        ]
      },
      "authority_for": [
        "Illustrative unresolved-condition behaviour"
      ],
      "not_authority_for": [
        "Institutional policy",
        "Customer risk assessment",
        "Permission to write to FenX"
      ],
      "supportingEvidence": [],
      "version": "1",
      "valid_from": null,
      "valid_until": null,
      "status": "draft",
      "revalidate_when": [
        "Source, task scope or intended use changes"
      ],
      "relationships": [],
      "runtimeEligible": false
    },
    {